{
  "course_id": "bn-en-v2",
  "version": "1.0.0",
  "language": "bengali",
  "register": "Colloquial Bangladeshi Bengali, romanized. tumi is the default level of address; apni is taught explicitly as the respectful one. The Bengali script is carried alongside every item so pronunciation reads real Bengali rather than an English approximation of it.",
  "note": "Original curriculum written for this app. Vocabulary reuses the v1 phrase id wherever the same item is taught, so spaced-repetition memory, the word bank and mistake history carry over.",
  "legal_note": "Not affiliated with, endorsed by, or derived from any commercial language course.",
  "sections": [
    {
      "section": 1,
      "title": "Your first Bengali",
      "description": "Greetings, how you are, your name, and the things around you."
    },
    {
      "section": 2,
      "title": "Everyday Bengali",
      "description": "Food, family, questions, and saying what you are doing and how you feel."
    },
    {
      "section": 3,
      "title": "Out in the world",
      "description": "Asking for help, finding your way, visiting a home, and small talk."
    }
  ],
  "units": [
    {
      "id": "bn-en-s01-u01",
      "section": 1,
      "unit": 1,
      "cefr": "Intro",
      "scaffold": 5,
      "title": "Your first words in Bengali",
      "objective": "Greet someone, thank them, and say yes and no.",
      "grammar_targets": [
        "greetings"
      ],
      "vocabulary": [
        {
          "id": "p-u01-l01-greetings-01",
          "bengali": "assalamualaikum",
          "script": "আসসালামু আলাইকুম",
          "english": "hello",
          "part_of_speech": "expression",
          "pronunciation": "as-sa-laa-mu a-lay-kum",
          "emoji": "👋"
        },
        {
          "id": "p-u01-l01-greetings-02",
          "bengali": "walaikum assalam",
          "script": "ওয়ালাইকুম আসসালাম",
          "english": "hello (reply)",
          "part_of_speech": "expression",
          "pronunciation": "wa-lay-kum as-sa-laam"
        },
        {
          "id": "p-u01-l01-greetings-03",
          "bengali": "dhonnobad",
          "script": "ধন্যবাদ",
          "english": "thank you",
          "part_of_speech": "expression",
          "pronunciation": "dhon-no-baad",
          "emoji": "🙏"
        },
        {
          "id": "p-u04-l01-yes-no-replies-01",
          "bengali": "ha",
          "script": "হ্যাঁ",
          "english": "yes",
          "part_of_speech": "adverb",
          "pronunciation": "hã",
          "emoji": "✅"
        },
        {
          "id": "p-u04-l01-yes-no-replies-02",
          "bengali": "na",
          "script": "না",
          "english": "no",
          "part_of_speech": "adverb",
          "pronunciation": "naa",
          "emoji": "❌"
        },
        {
          "id": "bn-en-s01-u01-v06",
          "bengali": "onek",
          "script": "অনেক",
          "english": "a lot, very much",
          "part_of_speech": "adverb",
          "pronunciation": "OH-nek"
        }
      ],
      "phrase_patterns": [
        {
          "id": "bn-en-s01-u01-p03",
          "bengali": "ha, onek dhonnobad",
          "script": "হ্যাঁ, অনেক ধন্যবাদ",
          "english": "yes, thank you very much"
        },
        {
          "id": "bn-en-s01-u01-p01",
          "bengali": "ha, dhonnobad",
          "script": "হ্যাঁ, ধন্যবাদ",
          "english": "yes, thank you"
        },
        {
          "id": "bn-en-s01-u01-p02",
          "bengali": "na, dhonnobad",
          "script": "না, ধন্যবাদ",
          "english": "no, thank you"
        }
      ],
      "notices": [
        {
          "id": "bn-u01-n01",
          "title": "Bengali greetings come in pairs",
          "examples": [
            {
              "bengali": "assalamualaikum",
              "english": "hello",
              "note": "what the first person says"
            },
            {
              "bengali": "walaikum assalam",
              "english": "hello (reply)",
              "note": "the same words, turned around"
            },
            {
              "bengali": "dhonnobad",
              "english": "thank you",
              "note": "this one works at any time of day"
            }
          ],
          "question": {
            "prompt": "Someone greets you with assalamualaikum. What do you say back?",
            "options": [
              "walaikum assalam",
              "assalamualaikum",
              "dhonnobad"
            ],
            "answer": "walaikum assalam",
            "explanation": "A Bengali greeting is a matched pair: the reply is the same two words in the other order. Answering with assalamualaikum would be greeting them rather than replying to them."
          }
        }
      ],
      "lesson_sequence": [
        {
          "lesson_index": 1,
          "name": "Discover",
          "goal": "Meet your first Bengali words."
        },
        {
          "lesson_index": 2,
          "name": "Build",
          "goal": "Put two of them together into a whole reply."
        },
        {
          "lesson_index": 3,
          "name": "Notice the pattern",
          "goal": "Work out how a Bengali greeting is answered."
        },
        {
          "lesson_index": 4,
          "name": "Unit review",
          "goal": "Bring back everything from this unit."
        }
      ]
    },
    {
      "id": "bn-en-s01-u02",
      "section": 1,
      "unit": 2,
      "cefr": "Intro",
      "scaffold": 5,
      "title": "How are you?",
      "objective": "Ask how someone is and say how you are.",
      "grammar_targets": [
        "ach- endings"
      ],
      "vocabulary": [
        {
          "id": "bn-en-s01-u02-v01",
          "bengali": "ami",
          "script": "আমি",
          "english": "I",
          "part_of_speech": "pronoun",
          "pronunciation": "AH-mi"
        },
        {
          "id": "bn-en-s01-u02-v02",
          "bengali": "tumi",
          "script": "তুমি",
          "english": "you",
          "part_of_speech": "pronoun",
          "pronunciation": "TU-mi"
        },
        {
          "id": "bn-en-s01-u02-v03",
          "bengali": "bhalo",
          "script": "ভালো",
          "english": "good, well",
          "part_of_speech": "adjective",
          "pronunciation": "BHA-lo"
        },
        {
          "id": "bn-en-s01-u02-v04",
          "bengali": "kemon",
          "script": "কেমন",
          "english": "how",
          "part_of_speech": "question",
          "pronunciation": "KEH-mon"
        },
        {
          "id": "bn-en-s01-u02-v05",
          "bengali": "achi",
          "script": "আছি",
          "english": "I am",
          "part_of_speech": "verb",
          "pronunciation": "AH-chi",
          "context_bn": "ami bhalo achi",
          "context_en": "I am well",
          "context_script": "আমি ভালো আছি"
        },
        {
          "id": "bn-en-s01-u02-v06",
          "bengali": "acho",
          "script": "আছো",
          "english": "you are",
          "part_of_speech": "verb",
          "pronunciation": "AH-cho",
          "context_bn": "tumi kemon acho?",
          "context_en": "how are you?",
          "context_script": "তুমি কেমন আছো?"
        },
        {
          "id": "bn-en-s01-u02-v07",
          "bengali": "khub",
          "script": "খুব",
          "english": "very",
          "part_of_speech": "adverb",
          "pronunciation": "khoob"
        },
        {
          "id": "p-u01-l02-how-are-you-04",
          "bengali": "motamuti",
          "script": "মোটামুটি",
          "english": "so-so",
          "part_of_speech": "adverb",
          "pronunciation": "mo-ta-MU-ti"
        },
        {
          "id": "bn-en-s01-u02-v09",
          "bengali": "thik",
          "script": "ঠিক",
          "english": "okay, fine",
          "part_of_speech": "adjective",
          "pronunciation": "thik"
        },
        {
          "id": "bn-en-s01-u02-v10",
          "bengali": "ar",
          "script": "আর",
          "english": "and",
          "part_of_speech": "conjunction",
          "pronunciation": "ar"
        }
      ],
      "phrase_patterns": [
        {
          "id": "p-u01-l02-how-are-you-01",
          "bengali": "tumi kemon acho?",
          "script": "তুমি কেমন আছো?",
          "english": "how are you?"
        },
        {
          "id": "p-u01-l02-how-are-you-02",
          "bengali": "ami bhalo achi",
          "script": "আমি ভালো আছি",
          "english": "I am well"
        },
        {
          "id": "p-u01-l02-how-are-you-03",
          "bengali": "khub bhalo",
          "script": "খুব ভালো",
          "english": "very good"
        },
        {
          "id": "p-u01-l02-how-are-you-05",
          "bengali": "ami thik achi",
          "script": "আমি ঠিক আছি",
          "english": "I am okay"
        },
        {
          "id": "p-u01-l02-how-are-you-06",
          "bengali": "ar tumi?",
          "script": "আর তুমি?",
          "english": "and you?"
        },
        {
          "id": "bn-en-s01-u02-p06",
          "bengali": "ami khub bhalo achi",
          "script": "আমি খুব ভালো আছি",
          "english": "I am very well"
        }
      ],
      "notices": [
        {
          "id": "bn-u02-n01",
          "title": "One word, two endings",
          "examples": [
            {
              "bengali": "ami bhalo achi",
              "english": "I am well",
              "note": "achi goes with ami"
            },
            {
              "bengali": "tumi kemon acho?",
              "english": "how are you?",
              "note": "acho goes with tumi"
            },
            {
              "bengali": "ami thik achi",
              "english": "I am okay",
              "note": "ami again, so achi again"
            }
          ],
          "question": {
            "prompt": "You want to ask a friend how they are. Which is right?",
            "options": [
              "tumi kemon acho?",